name,weight,price
NutriChoice Hi- Fibre Digestive- Wt.100gms,100gms,20.00
NutriChoice Hi- Fibre Digestive- Wt.75gms,75gms,15.00
NutriChoice 5 Grain,200gms,50.00
NutriChoice 5 Grain- 100gms,100gms,25.00
NutriChoice Oats - Diabetic Friendly Essen...,150gms,55.00
NutriChoice Hi-Fibre Digestive,100gms,20.00
Treat Jim Jam,200gms,25.00
Time Pass Nimkee,114gms,10.00
Time Pass Classic Salted,114gms,10.00
Tiger Glucose,323gms,20.00
Tiger ChocoChip Krunch,92gms,10.00
Sunfeast Special Tasty Pineapple Cream,129gms,10.00
Sunfeast Special Tasty Orange Cream,129gms,10.00
Sunfeast Special Tasty Elaichi Cream,129gms,10.00
Sunfeast Special Tasty Choco Cream,129gms,10.00
Sunfeast Special Choco Cookies,150gms,20.00
Sunfeast Special Cashew Cookies,150gms,20.00
Sunfeast Special Butter Cookies,200gms,20.00
Sunfeast Glucose Biscuits,300gms,20.00
Sunfeast Dream Cream Strawberry & Vanilla,150gms,20.00
Sunfeast Dark Fantasy Vanilla,96gms,22.00
Sunfeast Dark Fantasy Chocolate,96gms,22.00
Pure Magic Creams Vanilla,101gms,20.00
Pure Magic Choco Cream,101gms,20.00
Parle Top Crackers Biscuits,90gms,10.00
Parle Salted Nimkin Biscuits,60gms,5.00
Parle Munchies Sixer Biscuits,Jar of 200gms,40.00
Parle Munchies Jeffs Biscuits,Jar of 200gms,30.00
Parle Monaco Salted Jeera Biscuits,120gms,10.00
Parle Monaco Salted Biscuits,100gms,10.00
Parle Monaco Classic Biscuits,120gms,10.00
Parle Milk Shakti Biscuits,75gms,5.00
Parle Marie Choice Biscuits,134.4gms,10.00
Parle Marie Biscuits,180gms,10.00
Parle Magix Choco Biscuits,56.4gms,5.00
Parle Magix Cashew Biscuits,56.4gms,5.00
Parle Kreams Mango Biscuits,80gms,5.00
Parle Kreams Gold Pineapple Biscuits,80gms,5.00
Parle Kreams Gold Orange Biscuits,80gms,5.00
Parle Kreams Gold Elaichi Biscuits,80gms,5.00
Cinthol Deo Talc Cool,50gms,25.00
Pillsbury Custard Powder Golden Vanilla,100gms,35.00
Pillsbury Multigrain Atta,1kg,47.00
Aashirvaad Whole Wheat Atta,5kg,215.00
Kissan Mixed Fruit Jam,100gms,24.00
Lipton Green Tea Lemon Zest Tea Bags,20 Tea Bagsnos.,105.00
Godrej Aer Spray Musk After Smoke,300ml,120.00
Parampara Butter Chicken,60gms,45.00
Nature Valley Crunchy Oats & Dark Chocolate,252gms,240.00
Godrej Aer Click Gel Cool Surf Blue,Click 1nos.,250.00
NutriChoice Ragi Cookies- Diabetic Friendl...,75gms,25.00
NutriChoice Ragi Cookies- Diabetic Friendl...,150gms,50.00
Sunfeast Delishus Gourmet Cookies Nut Bicotti,150gms,60.00
Gaia Oatmeal Cookies,100gms,30.00
Gaia Multi Grain Cookies,100gms,30.00
Cadbury Biscuits Oreo Choco Creme,117.6gms,30.00
Cadbury Oreo Strawberry,150gms,30.00
Cadbury Oreo Orange,60gms,15.00
Saffola Total,1lt,195.00
Kissan Mixed Fruit Jam,100gms,24.00
Pillsbury Fridge Cheesecake Chocolate,165gms,125.00
Cinthol Deo Talc Cool,50gms,25.00
Cinthol Cool Soap,125gms,38.00
Lipton Green Tea Lemon Zest Tea Bags,20 Tea Bagsnos.,105.00
Maggi Tomato Ketchup,1kg,126.00
Dermicool Regular Talc,150gms,63.00
Pillsbury Multigrain Atta,1kg,47.00
Sofit Soya Milk Chocolate,1lt,95.00
Parle Kreams Chocolate Biscuits,20gms,2.00
Parle Kreams Bourbon Biscuits,100gms,10.00
Parle Krackjack Biscuits,50gms,5.00
Parle Hide & Seek Milano Butterscotch,72gms,20.00
Parle Hide & Seek Coffee Biscuit,93.5gms,20.00
Parle Hide & Seek Chocolate Chip Biscuit,50gms,12.00
Parle Hide & Seek Bourbon Biscuit,150gms,25.00
Parle Festo Kreams Pineapple Round Biscuits,80gms,5.00
Parle Digestive Marie,67gms,7.00
Parle Coconut Biscuits,50gms,5.00
Parle Cheeslings Classic Biscuits,20gms,5.00
Parle 20-20 Cashew Cookies,60gms,5.00
Parle 20-20 Butter Cookies,50gms,5.00
McVities Digestive Biscuits,74gms,12.00
McVities Cashew Cookies,68gms,10.00
McVities Butter Cookies,68gms,10.00
Little Hearts,50.5gms,10.00
Sunfeast Dark Fantasy Choco Fills,75gms,30.00
Horlicks Biscuit Standard,120gms,10.00
Horlicks Biscuit Elaichi,120gms,10.00
Cadbury Oreo Biscuit,50gms,11.00
Britannia Nice Time,160gms,18.00
Britannia Milk Bikis-Milk Cream,156gms,25.00
Britannia Marie Gold Biscuit,300gms,30.00
Britannia Goodday Pista Badam Cookies,90gms,20.00
Britannia Goodday Chocolate Chip Cookies,50gms,10.00
Britannia Goodday Choco Nut Cookies,60gms,12.00
Britannia Goodday Cashew Cookies,100gms,15.00
Britannia Goodday Butter Cookies,50gms,5.00
Britannia Cookies Butter Elaichiz,222gms,20.00
Britannia Bourbon Biscuit,40gms,5.00
Britannia 50 50 Sweet n Salty Biscuit,113gms,13.00
Britannia 50 50 Maska Chaska Biscuit,61.5gms,10.00
Tiffany Custard Flavoured Cream Biscuits,90gms,20.00
Sunfeast Dream Cream Chocolate & Vanilla,150gms,20.00
Sunfeast Dream Cream Bourbon Delight,150gms,24.00
Sunfeast Special Kesari Elaichi Cookies,200gms,20.00
NutriChoice Hi-Fibre Digestive- Wt.250gms,250gms,50.00
NutriChoice Oats Cookies- Diabetic Friendl...,75gms,25.00
NutriChoice Oats Cookies- Diabetic Friendl...,150gms,50.00
Pillsbury Multigrain Atta,1kg,47.00
Dermicool Regular Talc,150gms,63.00
Pillsbury Gold Atta,5kg,225.00
Pillsbury Fridge Cheesecake Chocolate,165gms,125.00
Nature Valley Crunchy Oats & Dark Chocolate,252gms,240.00
Cadbury Biscuits Oreo Choco Creme,117.6gms,30.00
Real Apple Juice,1lt,95.00
Pillsbury Custard Powder Golden Vanilla,100gms,35.00
Amul Pasteurised Butter,100gms,35.00
Cinthol Ignite Deo Spray,215ml,175.00
